{
  "schema_version": 1,
  "event_id": "REO-2026-07-24-008",
  "recorded_on": "2026-07-24",
  "candidate_id": "HIST-P0-GLV-PAIR-ENUMERATION-24BIT-AMBIENT",
  "hypothesis_id": "HYP_GLV_SEMAEV_001",
  "route_id": "R-GLV-SEMAEV",
  "outcome": "inapplicable",
  "scope": {
    "target_kind": "toy",
    "curve_family": "ambient-group toy j=0 curve with cofactor 3",
    "field_bits": [
      24
    ],
    "threat_model": "classical-single-target-plain",
    "claim_boundary": "Ambient-group relation-yield sanity check only; this is not a prime-order subgroup index-calculus result."
  },
  "summary": "The legacy 24-bit P0 rows used a cofactor-3 curve while sampling the ambient group, so factor-base logarithms relative to the chosen subgroup generator need not exist and those rows cannot support the subgroup route claim.",
  "evidence_files": [
    "experiments/p0_glv_semaev/README.md",
    "experiments/p0_glv_semaev/RESULTS.md",
    "experiments/p0_glv_semaev/runs/HYP_GLV_SEMAEV_001_plain-core_76456051aa21.json",
    "experiments/p0_glv_semaev/runs/HYP_GLV_SEMAEV_001_glv-base_bc9066a58ada.json",
    "experiments/p0_glv_semaev/runs/HYP_GLV_SEMAEV_001_invariant-u_95decc4378f5.json"
  ],
  "validation": {
    "status": "passed",
    "independent": true,
    "decisive_claim_validated": true,
    "evidence_files": [
      "experiments/p0_glv_semaev/validate_run.py",
      "experiments/p0_glv_semaev/RESULTS.md"
    ]
  },
  "budget": {
    "status": "historical_not_recorded",
    "wall_time_seconds": null,
    "peak_memory_bytes": null,
    "parallel_workers": null
  },
  "stop_condition": {
    "triggered": true,
    "statement": "The cofactor mismatch makes the legacy 24-bit rows inapplicable to the declared subgroup route."
  },
  "residual_uncertainty": [
    "The ambient-group relation-yield measurements remain valid only as implementation sanity checks.",
    "No 24-bit cofactor-1 subgroup result is inferred."
  ],
  "reopening_condition": "Run a separately preregistered cofactor-1 or subgroup-only 24-bit experiment with every factor-base point proven to lie in the target subgroup.",
  "provenance": {
    "source_kind": "historical_migration",
    "source_commit": "1a1b5ddba7e9a6e3d40f189892e83529f5bc6616",
    "migration_note": "Split from the original aggregate P0 migration after adversarial review identified the cofactor-3 ambient-group scope.",
    "run_manifest": null,
    "run_manifest_sha256": null
  }
}
